"large_image.alt","large_image.src","large_image.href","large_image.text","title.href","title.text","tag_desc","ogi_pinner.href","ogi_pinner.text","board_name.href","board_name.text"
"Elegant beach ceremony: http://www.stylemepretty.com/2014/03/07/destination-wedding-in-puerto-vallarta-mexico/ | Photography: Clary Pfeiffer - http://www.claryphoto.com/","https://s-media-cache-ak0.pinimg.com/736x/a6/ea/77/a6ea77a80a4f33778bbcb7716b7b1960.jpg","http://www.stylemepretty.com/2014/03/07/destination-wedding-in-puerto-vallarta-mexico/","","http://www.stylemepretty.com/2014/03/07/destination-wedding-in-puerto-vallarta-mexico/","Destination Wedding in Puerto Vallarta, Mexico","Right about now, as my house lies snuggled in a foot of snow, Mexico is sounding pretty amazing. It’s a land where sunshine is a mainstay and seaside nuptials are a part of the landscape. And local darlings, The Dazzling Details, know just how to whip those nuptials into shape. The result is a neutr...","http://www.stylemepretty.com/2014/03/07/destination-wedding-in-puerto-vallarta-mexico/","Style Me Pretty","https://www.pinterest.com/stylemepretty/beach-weddings/","Beach Weddings"
"Romantic Cape Cod wedding: http://www.stylemepretty.com/massachusetts-weddings/cape-cod/2015/02/23/whimsical-cape-cod-wedding/ | Photography: Ruth Eileen - http://rutheileenphotography.com/","https://s-media-cache-ak0.pinimg.com/736x/b8/f6/d6/b8f6d6880191807b91095ebc6037521b.jpg","http://www.stylemepretty.com/massachusetts-weddings/cape-cod/2015/02/23/whimsical-cape-cod-wedding/","","http://www.stylemepretty.com/massachusetts-weddings/cape-cod/2015/02/23/whimsical-cape-cod-wedding/","Whimsical Cape Cod Wedding","Let’s face it, any wedding with Ruth Eileen behind the lens is destined for perfection. Beginning with the Bride’s dove grey gown, to the astilbe accented Beach Plum Floral bouquets, to the paper cranes, and antique finds, it’s all of these perfectly styled elements that steal the show. The result i...","http://www.stylemepretty.com/massachusetts-weddings/cape-cod/2015/02/23/whimsical-cape-cod-wedding/","Style Me Pretty",""
"A beautiful welcome dinner dress: http://www.stylemepretty.com/2015/02/23/dominican-republic-wedding-welcome-dinner/ | Photography: Ryan Ray - http://ryanrayphoto.com/","https://s-media-cache-ak0.pinimg.com/736x/8f/5f/b0/8f5fb01c2ecae6430a8ce6204662a2a0.jpg","http://www.stylemepretty.com/2015/02/23/dominican-republic-wedding-welcome-dinner/","","http://www.stylemepretty.com/2015/02/23/dominican-republic-wedding-welcome-dinner/","Dominican Republic Wedding Welcome Dinner","Kicking off a new week is often easier said than done, but this Monday just got a whole lot better with Ryan Ray wedding goodness from morning ’til night. I’m talking a four-part feature set in the Dominican Republic, starting with this gorgeous rehearsal dinner designed in the hands of Stefanie Mil...","http://www.stylemepretty.com/2015/02/23/dominican-republic-wedding-welcome-dinner/","Style Me Pretty","https://www.pinterest.com/stylemepretty/beach-weddings/","Beach Weddings"
"Beach engagement: http://www.stylemepretty.com/2014/03/11/elegant-beach-wedding-inspiration/ | Photography: Sylvie Gil - http://www.sylviegilphotography.com/","https://s-media-cache-ak0.pinimg.com/736x/28/4a/70/284a7094b316b31181de89f638aaf989.jpg","http://www.stylemepretty.com/2014/03/11/elegant-beach-wedding-inspiration/","","http://www.stylemepretty.com/2014/03/11/elegant-beach-wedding-inspiration/","Elegant Beach Wedding Inspiration","We love a new twist on tradition; a style that brings a fresh layer to a tried and true classic like the Beach wedding. With concept and beauty by Katie Nash Beauty, styling by Enjoy Events Co., crazy good florals by Max Gill and the loveliest photographs by Sylvie Gil, this inspiration is out to pr...","http://www.stylemepretty.com/2014/03/11/elegant-beach-wedding-inspiration/","Style Me Pretty",""
"Lanterns and flowers line the beach aisle: http://www.stylemepretty.com/2015/02/04/elegant-riviera-maya-destination-wedding/ | Photography: Samuel Lippke - http://samuellippke.com/","https://s-media-cache-ak0.pinimg.com/736x/ef/50/26/ef502600dabaa56439ff5044971b3d24.jpg","http://www.stylemepretty.com/2015/02/04/elegant-riviera-maya-destination-wedding/","","http://www.stylemepretty.com/2015/02/04/elegant-riviera-maya-destination-wedding/","Elegant Riviera Maya Destination Wedding","Planning a destination wedding is no easy feat, but thanks to SIGNATURE, Event Consulting & Design every detail of this Riviera Maya affair went off without a hitch. From the bride who rocked a killer ballgown on the beach to the blooms all designed by Elena Damy, this tropical “I do” is going down ...","http://www.stylemepretty.com/2015/02/04/elegant-riviera-maya-destination-wedding/","Style Me Pretty",""
"Dreamy beach wedding: http://www.stylemepretty.com/massachusetts-weddings/mashpee/2015/02/16/whimsical-cape-cod-beach-wedding/ | Photography: Melissa Robotti - http://www.melissarobottiphotography.com/","https://s-media-cache-ak0.pinimg.com/736x/c7/12/e9/c712e9f81cbbd7d80ff56f7ead0a8fbb.jpg","http://www.stylemepretty.com/massachusetts-weddings/mashpee/2015/02/16/whimsical-cape-cod-beach-wedding/","","http://www.stylemepretty.com/massachusetts-weddings/mashpee/2015/02/16/whimsical-cape-cod-beach-wedding/","Whimsical Cape Cod Beach Wedding","If you were to ask me, this beachside Wychmere Beach Club affair has the best of everything. From the wonderfully casual driftwood accents, to innately elegant ombre invitations, to Lilacs Juliette rose bouquets, to Lanvin clad Bride, each stunning moment capture by Melissa Robotti is New England at...","http://www.stylemepretty.com/massachusetts-weddings/mashpee/2015/02/16/whimsical-cape-cod-beach-wedding/","Style Me Pretty","https://www.pinterest.com/stylemepretty/beach-weddings/","Beach Weddings"
"Jump for joy: http://www.stylemepretty.com/2015/02/10/inspired-by-johnny-depps-beachfront-nuptials/","https://s-media-cache-ak0.pinimg.com/736x/3d/a8/77/3da877504f9ffd0d3e173c223303c390.jpg","http://www.stylemepretty.com/2015/02/10/inspired-by-johnny-depps-beachfront-nuptials/","","http://www.stylemepretty.com/2015/02/10/inspired-by-johnny-depps-beachfront-nuptials/","Inspired By: Johnny Depp's Beachfront Nuptials","When we got word Johnny Depp and Amber Heard tied the knot on the white sandy beaches of the Bahamas, we couldn’t help but dream of what it must have looked like. Ocean waves, toes in the sand and plenty of gorgeous details were surely in the mix, and inspired by all the loveliness we rounded […]","http://www.stylemepretty.com/2015/02/10/inspired-by-johnny-depps-beachfront-nuptials/","Style Me Pretty",""
"Beach table: http://www.stylemepretty.com/2014/01/17/beach-elopement-wedding-inspiration/ | Photography: Lauren Kinsey - http://www.laurenkinsey.com/","https://s-media-cache-ak0.pinimg.com/736x/5d/a7/ea/5da7eacad9f04700899fd4068512aedc.jpg","http://www.stylemepretty.com/2014/01/17/beach-elopement-wedding-inspiration/","","http://www.stylemepretty.com/2014/01/17/beach-elopement-wedding-inspiration/","Beach Elopement Wedding Inspiration","Every time a Lauren Kinsey email hits my inbox, I know a happy dance is right around the corner. And today, m’dears, is certainly no exception. She partnered with Alee Willis and Nathan Willis Wedding Films for a beach elopement inspiration shoot and the results left us flat-out speechless. Get read...","http://www.stylemepretty.com/2014/01/17/beach-elopement-wedding-inspiration/","Style Me Pretty",""
"Shoes: http://www.stylemepretty.com/2015/02/10/inspired-by-johnny-depps-beachfront-nuptials/","https://s-media-cache-ak0.pinimg.com/736x/6d/e6/f3/6de6f3b008a5b5c9e6ce85c6e9255d16.jpg","http://www.stylemepretty.com/2015/02/10/inspired-by-johnny-depps-beachfront-nuptials/","","http://www.stylemepretty.com/2015/02/10/inspired-by-johnny-depps-beachfront-nuptials/","Inspired By: Johnny Depp's Beachfront Nuptials","When we got word Johnny Depp and Amber Heard tied the knot on the white sandy beaches of the Bahamas, we couldn’t help but dream of what it must have looked like. Ocean waves, toes in the sand and plenty of gorgeous details were surely in the mix, and inspired by all the loveliness we rounded […]","http://www.stylemepretty.com/2015/02/10/inspired-by-johnny-depps-beachfront-nuptials/","Style Me Pretty","https://www.pinterest.com/stylemepretty/beach-weddings/","Beach Weddings"
"Picture perfect beach wedding: http://www.stylemepretty.com/2015/02/10/inspired-by-johnny-depps-beachfront-nuptials/","https://s-media-cache-ak0.pinimg.com/736x/22/91/b9/2291b9b8d79685429f3e8394935da40e.jpg","http://www.stylemepretty.com/2015/02/10/inspired-by-johnny-depps-beachfront-nuptials/","","http://www.stylemepretty.com/2015/02/10/inspired-by-johnny-depps-beachfront-nuptials/","Inspired By: Johnny Depp's Beachfront Nuptials","When we got word Johnny Depp and Amber Heard tied the knot on the white sandy beaches of the Bahamas, we couldn’t help but dream of what it must have looked like. Ocean waves, toes in the sand and plenty of gorgeous details were surely in the mix, and inspired by all the loveliness we rounded […]","http://www.stylemepretty.com/2015/02/10/inspired-by-johnny-depps-beachfront-nuptials/","Style Me Pretty","https://www.pinterest.com/stylemepretty/beach-weddings/","Beach Weddings"
"Perfect backdrop: http://www.stylemepretty.com/2015/02/10/inspired-by-johnny-depps-beachfront-nuptials/","https://s-media-cache-ak0.pinimg.com/736x/3c/4b/d3/3c4bd32144679f40ff460fee52073d78.jpg","http://www.stylemepretty.com/2015/02/10/inspired-by-johnny-depps-beachfront-nuptials/","","http://www.stylemepretty.com/2015/02/10/inspired-by-johnny-depps-beachfront-nuptials/","Inspired By: Johnny Depp's Beachfront Nuptials","When we got word Johnny Depp and Amber Heard tied the knot on the white sandy beaches of the Bahamas, we couldn’t help but dream of what it must have looked like. Ocean waves, toes in the sand and plenty of gorgeous details were surely in the mix, and inspired by all the loveliness we rounded […]","http://www.stylemepretty.com/2015/02/10/inspired-by-johnny-depps-beachfront-nuptials/","Style Me Pretty",""
"Ocean treasures: http://www.stylemepretty.com/2015/02/10/inspired-by-johnny-depps-beachfront-nuptials/","https://s-media-cache-ak0.pinimg.com/736x/15/cc/2b/15cc2bebaea5e625272c2190d46136c0.jpg","http://www.stylemepretty.com/2015/02/10/inspired-by-johnny-depps-beachfront-nuptials/","","http://www.stylemepretty.com/2015/02/10/inspired-by-johnny-depps-beachfront-nuptials/","Inspired By: Johnny Depp's Beachfront Nuptials","When we got word Johnny Depp and Amber Heard tied the knot on the white sandy beaches of the Bahamas, we couldn’t help but dream of what it must have looked like. Ocean waves, toes in the sand and plenty of gorgeous details were surely in the mix, and inspired by all the loveliness we rounded […]","http://www.stylemepretty.com/2015/02/10/inspired-by-johnny-depps-beachfront-nuptials/","Style Me Pretty","https://www.pinterest.com/stylemepretty/beach-weddings/","Beach Weddings"
"A stroll on the beach: http://www.stylemepretty.com/michigan-weddings/2015/02/11/secret-beach-wedding-inspiration-at-sleeping-bear-dunes/ | Photography: Lauren Kinsey - http://laurenkinsey.com/","https://s-media-cache-ak0.pinimg.com/736x/c2/70/4f/c2704fbec5bccce5ecf8062ee5fa17e6.jpg","http://www.stylemepretty.com/michigan-weddings/2015/02/11/secret-beach-wedding-inspiration-at-sleeping-bear-dunes/","","http://www.stylemepretty.com/michigan-weddings/2015/02/11/secret-beach-wedding-inspiration-at-sleeping-bear-dunes/","Secret Beach Wedding Inspiration at Sleeping Bear Dunes","Sometimes I fall so hard for the beautiful things we get to feature on SMP, I can barely contain myself. Well, that’s just what happened when I laid eyes on this seaside shoot from Lauren Kinsey. Because it’s basically my idea of perfection. With florals from Bloom Floral Design, planning from Since...","http://www.stylemepretty.com/michigan-weddings/2015/02/11/secret-beach-wedding-inspiration-at-sleeping-bear-dunes/","Style Me Pretty","https://www.pinterest.com/stylemepretty/beach-weddings/","Beach Weddings"
"Seaside ceremony: http://www.stylemepretty.com/2015/02/10/inspired-by-johnny-depps-beachfront-nuptials/","https://s-media-cache-ak0.pinimg.com/736x/15/de/ec/15deec5aa2de7aec04968e8e0120b5fd.jpg","http://www.stylemepretty.com/2015/02/10/inspired-by-johnny-depps-beachfront-nuptials/","","http://www.stylemepretty.com/2015/02/10/inspired-by-johnny-depps-beachfront-nuptials/","Inspired By: Johnny Depp's Beachfront Nuptials","When we got word Johnny Depp and Amber Heard tied the knot on the white sandy beaches of the Bahamas, we couldn’t help but dream of what it must have looked like. Ocean waves, toes in the sand and plenty of gorgeous details were surely in the mix, and inspired by all the loveliness we rounded […]","http://www.stylemepretty.com/2015/02/10/inspired-by-johnny-depps-beachfront-nuptials/","Style Me Pretty","https://www.pinterest.com/stylemepretty/beach-weddings/","Beach Weddings"
"Seaside wedding table for two: http://www.stylemepretty.com/australia-weddings/western-australia-au/perth/2014/12/04/perth-oceanside-wedding-inspiration/ | Photography: Katie Grant - http://www.katiegrantphoto.com/","https://s-media-cache-ak0.pinimg.com/736x/15/cc/2b/15cc2bebaea5e625272c2190d46136c0.jpg","http://www.stylemepretty.com/australia-weddings/western-australia-au/perth/2014/12/04/perth-oceanside-wedding-inspiration/","","http://www.stylemepretty.com/australia-weddings/western-australia-au/perth/2014/12/04/perth-oceanside-wedding-inspiration/","Perth Oceanside Wedding Inspiration","A day spent by the sea, this inspiration shoot is overflowing with pretty. Created and captured by Katie Grant, the poetic breeze subtly compliments the flowing train of the stunning Watters Wtoo gown. Topped off with a seashell crown and an Erica Koesler veil, every image in the full gallery will h...","http://www.stylemepretty.com/australia-weddings/western-australia-au/perth/2014/12/04/perth-oceanside-wedding-inspiration/","Style Me Pretty",""
"Winter beach wedding inspiration: http://www.stylemepretty.com/little-black-book-blog/2015/02/04/swedish-seaside-sinter-wedding-inspiration/ | Photography: 2 Brides - http://2brides.se/","https://s-media-cache-ak0.pinimg.com/736x/96/c5/84/96c584159c70f6ae8e4166e38f18617d.jpg","http://www.stylemepretty.com/little-black-book-blog/2015/02/04/swedish-seaside-sinter-wedding-inspiration/","","http://www.stylemepretty.com/little-black-book-blog/2015/02/04/swedish-seaside-sinter-wedding-inspiration/","Swedish Seaside Winter Wedding Inspiration","Equally gorgeous and contrasting in the most stunning way, this Swedish slice of pretty from 2 Brides Photography is the best of both worlds. Ethereally romantic with a touch of boho vs. bold, fierce high fashion—each look paired with petals from Linnéa Bergqvist and graced with Zetterberg Couture g...","http://www.stylemepretty.com/little-black-book-blog/2015/02/04/swedish-seaside-sinter-wedding-inspiration/","Style Me Pretty","https://www.pinterest.com/stylemepretty/beach-weddings/","Beach Weddings"
"Lake Tahoe wedding: http://www.stylemepretty.com/2015/02/04/stylish-lake-tahoe-summer-wedding/ | Photography: Melina Wallisch - http://melinawallisch.com/","https://s-media-cache-ak0.pinimg.com/736x/15/21/e1/1521e1fad4945279798defcf9a54a0bb.jpg","http://www.stylemepretty.com/2015/02/04/stylish-lake-tahoe-summer-wedding/","","http://www.stylemepretty.com/2015/02/04/stylish-lake-tahoe-summer-wedding/","Stylish Lake Tahoe Summer Wedding","I’ve never been to Lake Tahoe, but after only five minutes with this wedding it was inching towards the top of my must-visit list. Filled with picturesque views and toes in the sand, it’s the prettiest backdrop a couple could ask for, made EVEN better by Felicia Events. See every style-filled moment...","http://www.stylemepretty.com/2015/02/04/stylish-lake-tahoe-summer-wedding/","Style Me Pretty",""
"Sunglasses for the ceremony: http://www.stylemepretty.com/2014/09/11/romantic-cliff-top-wedding-by-the-sea-in-bali/ | Photography: Jemma Keech - http://jemmakeech.com/","https://s-media-cache-ak0.pinimg.com/736x/8a/2f/13/8a2f13d3dd25596c58432078e105191a.jpg","http://www.stylemepretty.com/2014/09/11/romantic-cliff-top-wedding-by-the-sea-in-bali/","","http://www.stylemepretty.com/2014/09/11/romantic-cliff-top-wedding-by-the-sea-in-bali/","Romantic Cliff-top Wedding by the Sea in Bali","Cliff-top in Bali is a dream destination for most and when you see how that cliff was transformed into a romantic glittering evening under the stars, you might just jump ship and come on over to the destination wedding side. It’s travel meets Lazaro gown perfection crafted by CherAnge + Gloriosa and...","http://www.stylemepretty.com/2014/09/11/romantic-cliff-top-wedding-by-the-sea-in-bali/","Style Me Pretty","https://www.pinterest.com/stylemepretty/beach-weddings/","Beach Weddings"
"Romantic beach wedding: http://www.stylemepretty.com/2014/07/28/elegant-beachside-wedding-in-la-jolla-california/ | Photography: Carmen Santorelli - http://carmensantorellistudio.com/","https://s-media-cache-ak0.pinimg.com/736x/04/2d/f5/042df5cf663905f1e6d4bc20c744b540.jpg","http://www.stylemepretty.com/2014/07/28/elegant-beachside-wedding-in-la-jolla-california/","","http://www.stylemepretty.com/2014/07/28/elegant-beachside-wedding-in-la-jolla-california/","Elegant Beachside Wedding in La Jolla, California","The perfect printed linen is one of those small elements with a big impact. It takes the beauty of this modern beach wedding designed by Before I Do Events and adds a layer of chic so beautifully photographed by Carmen Santorelli. Seashells, modern beach lounging and lovely blooms by Isari Flower St...","http://www.stylemepretty.com/2014/07/28/elegant-beachside-wedding-in-la-jolla-california/","Style Me Pretty",""
"Beach bride: http://www.stylemepretty.com/little-black-book-blog/2015/01/23/coastal-united-kingdom-wedding-inspiration/ | Photography: Belle & Beau - http://belleandbeaublog.com/","https://s-media-cache-ak0.pinimg.com/736x/db/eb/19/dbeb19c2a1dcfafb5c57e67175248506.jpg","http://www.stylemepretty.com/little-black-book-blog/2015/01/23/coastal-united-kingdom-wedding-inspiration/","","http://www.stylemepretty.com/little-black-book-blog/2015/01/23/coastal-united-kingdom-wedding-inspiration/","Coastal United Kingdom Wedding Inspiration","If I could take this shoot and with the snap of my finger turn it into my wedding day, I would in a heartbeat. To say that it’s everything I want my wedding to encompass is quite the understatement. Raw, simplistic beauty, flow-y dresses, utterly gorg florals from Lucy MacNicoll, ridiculously captiv...","http://www.stylemepretty.com/little-black-book-blog/2015/01/23/coastal-united-kingdom-wedding-inspiration/","Style Me Pretty",""
"Beautiful blue maxi","https://s-media-cache-ak0.pinimg.com/736x/e0/f3/b6/e0f3b63091c637ffea50805bc2afc8ff.jpg","http://www.shopstyle.com/action/loadRetailerProductPage?id=446634545&pid=uid7636-26905194-76","","","","","https://www.pinterest.com/nordstrom/beach-wedding-ideas/","Beach Wedding Ideas"
"gems and rocks escort cards","https://s-media-cache-ak0.pinimg.com/736x/f2/a6/60/f2a6606ad1a6733543dcd49646513465.jpg","http://ohsobeautifulpaper.com/2012/10/wedding-stationery-inspiration-die-cutting/?utm_source=rss&utm_medium=rss&utm_campaign=wedding-stationery-inspiration-die-cutting","","http://ohsobeautifulpaper.com/2012/10/wedding-stationery-inspiration-die-cutting/?utm_source=rss&utm_medium=rss&utm_campaign=wedding-stationery-inspiration-die-cutting","Wedding Stationery Inspiration: Die-Cutting","I’m making you think outside of the box, quite literally, today! You can easily add an extra layer of interest and dimension to your day-of wedding stationery with unique die cut shapes. Die cutting can be used to create a geometric statement with your place cards or to add an intricate border to yo...","http://ohsobeautifulpaper.com/2012/10/wedding-stationery-inspiration-die-cutting/?utm_source=rss&utm_medium=rss&utm_campaign=wedding-stationery-inspiration-die-cutting","Oh So Beautiful Paper","https://www.pinterest.com/nordstrom/beach-wedding-ideas/","Beach Wedding Ideas"
"White geo necklace","https://s-media-cache-ak0.pinimg.com/736x/95/2a/ec/952aec555be6c21f712b1c6ae40afbaf.jpg","http://shop.nordstrom.com/s/kate-spade-new-york-daylight-jewels-statement-necklace/3965068","","","","",""
"sweet studs","https://s-media-cache-ak0.pinimg.com/736x/e2/92/3d/e2923d22542bec789c1299a735b3970f.jpg","http://www.theperfectpaletteshop.com/#!bridesmaid-gifts/c1q5k","","","","",""
"Beautifully embellished","https://s-media-cache-ak0.pinimg.com/736x/cd/02/17/cd0217a1057698a221aa6e4f640bbe15.jpg","http://shop.nordstrom.com/s/js-collections-beaded-empire-waist-chiffon-gown/3906735","","","","","https://www.pinterest.com/nordstrom/beach-wedding-ideas/","Beach Wedding Ideas"
"sweet bow studs","https://s-media-cache-ak0.pinimg.com/736x/6e/e4/66/6ee4664830d110af9fdfd90e594528c0.jpg","http://shop.nordstrom.com/s/kate-spade-new-york-tied-up-bow-stud-earrings/3964902","","","","","https://www.pinterest.com/nordstrom/beach-wedding-ideas/","Beach Wedding Ideas"
"Cute one piece","https://s-media-cache-ak0.pinimg.com/736x/3e/84/85/3e8485b4672bbfa9cd1c665b43afeebc.jpg","http://shop.nordstrom.com/o/maaji-mystic-paths-tankini-top-bottoms/3746343","","","","","https://www.pinterest.com/nordstrom/beach-wedding-ideas/","Beach Wedding Ideas"
"Art deco inspired gown by Adrianna Papell","https://s-media-cache-ak0.pinimg.com/736x/c2/40/48/c2404810b4f289ab2f23762f42cd9e99.jpg","http://shop.nordstrom.com/s/adrianna-papell-beaded-chiffon-blouson-dress/3757870","","","","","https://www.pinterest.com/nordstrom/beach-wedding-ideas/","Beach Wedding Ideas"
"Beautifully embellished","https://s-media-cache-ak0.pinimg.com/736x/0d/0f/3b/0d0f3b293eebe49c2f0c28fa075db546.jpg","http://www.theperfectpaletteshop.com/#!bridesmaid-dresses/c1oc8","","","","",""
"Pretty prints","https://s-media-cache-ak0.pinimg.com/736x/78/8a/c4/788ac4618ddb70b0f48a1d70323021ef.jpg","http://shop.nordstrom.com/s/nanette-lepore-paloma-goddess-one-piece-halter-swimsuit/3858950","","","","","https://www.pinterest.com/nordstrom/beach-wedding-ideas/","Beach Wedding Ideas"
"sweet suit http://rstyle.me/n/w6jdan2bn","https://s-media-cache-ak0.pinimg.com/736x/ad/b2/ab/adb2ab999328ed10e4300182cc037eb5.jpg","http://shop.nordstrom.com/s/nanette-lepore-bollywood-goddess-one-piece-swimsuit/3936820","","","","","https://www.pinterest.com/nordstrom/beach-wedding-ideas/","Beach Wedding Ideas"
"Bridesmaid Looks You'll Love  - http://www.theperfectpalette.com/2015/01/bridesmaid-looks-youll-love-embellished.html - Styled Pretty","https://s-media-cache-ak0.pinimg.com/736x/1a/ff/1c/1aff1caf664420607675827c1c92eac0.jpg","http://www.theperfectpalette.com/2015/01/bridesmaid-looks-youll-love-embellished.html","","http://www.theperfectpalette.com/2015/01/bridesmaid-looks-youll-love-embellished.html","Bridesmaid Looks You'll Love: Embellished Gowns!","The Perfect Palette is a wedding resource dedicated to helping couples find the perfect color palette for their wedding day.","http://www.theperfectpalette.com/2015/01/bridesmaid-looks-youll-love-embellished.html","The Perfect Palette","https://www.pinterest.com/nordstrom/beach-wedding-ideas/","Beach Wedding Ideas"
"Appy Couple I This design is perfect for a Hawaiian wedding or a beach wedding! Create your own wedding app and website at appycouple.com","https://s-media-cache-ak0.pinimg.com/736x/40/16/28/4016287b0da5ce8b2d49f3b30f1e37bf.jpg","http://www.appycouple.com/weddingwebsite_B?utm_source=Pinterest&utm_medium=Pin&utm_content=PinterestPins&utm_campaign=PinterestPerfectPalette","","","","","https://www.pinterest.com/nordstrom/beach-wedding-ideas/","Beach Wedding Ideas"
"sweet suit","https://s-media-cache-ak0.pinimg.com/736x/ec/e6/7b/ece67b3e63b22db18e6a6ab44e1d658b.jpg","http://shop.nordstrom.com/o/maaji-diamond-stallion-tankini-bikini-bottoms/3935430","","","","","https://www.pinterest.com/nordstrom/beach-wedding-ideas/","Beach Wedding Ideas"
"Bridal reception chairs. A turquoise, seaside bridal shower with Martha Celebrations! #SomethingTurquoise #LetsCelebrate (photo by: http://studioelevenweddings.com/)","https://s-media-cache-ak0.pinimg.com/736x/13/99/f0/1399f06a02388cb01f90c345c8f57b23.jpg","http://somethingturquoise.com/2013/06/07/seaside-bridal-shower-martha-celebrations/","","http://somethingturquoise.com/2013/06/07/seaside-bridal-shower-martha-celebrations/","Seaside Bridal Shower with Martha Celebrations","DIY bridal shower with Martha Celebrations","http://somethingturquoise.com/2013/06/07/seaside-bridal-shower-martha-celebrations/","Something Turquoise {embracing the DIY bride}","https://www.pinterest.com/jencarreiro/beach-wedding-ideas/","Beach Wedding Ideas"
"Branches for decor are always beautiful.","https://s-media-cache-ak0.pinimg.com/736x/e3/b6/bb/e3b6bb376dea70038d63483b04112b42.jpg","http://www.myhotelwedding.com/2012/10/22/a-personal-blush-cream-black-celebration-at-the-seven4one-hotel-laguna-beach-ca/","","http://www.myhotelwedding.com/2012/10/22/a-personal-blush-cream-black-celebration-at-the-seven4one-hotel-laguna-beach-ca/","A Personal Blush, Cream & Black Celebration at the Seven4one Hotel, Laguna Beach…","In our hopes to share the variety of hotel weddings that are possible with our readers, we have found an elegant black and white wedding ceremony followed by a cocktail party with this couple's nearest and dearest friends. Nicole & … Continue reading →","http://www.myhotelwedding.com/2012/10/22/a-personal-blush-cream-black-celebration-at-the-seven4one-hotel-laguna-beach-ca/","My Hotel Wedding","https://www.pinterest.com/nordstrom/beach-wedding-ideas/","Beach Wedding Ideas"
